{
  "id": "START-ST-SUCCESSOR-20261010043942038-ebe8da",
  "kind": "profile_task_start_receipt",
  "schema_version": "profile-task-start-receipt:v2",
  "story_id": "ST-SUCCESSOR",
  "phase": "implementation",
  "route": "claim_and_implement",
  "contract_id": "CONTRACT-SUCCESSOR",
  "contract_approval_hash": "370985efd6d86e03b951a77687483e04c3557eafdb1101906bc347db47db1b3d",
  "delivery_profile_ref": {
    "id": "AUT-SUCCESSOR",
    "path": ".sdlc/autonomy/deliveries/AUT-SUCCESSOR.json",
    "hash": "c459708295cdbd9b5378f534150c87951becc783c9952da88b6dda41927ba98a"
  },
  "autonomy_decision_ref": {
    "id": "AUT-DEC-20261010043941588-7a619d",
    "path": ".sdlc/autonomy/decisions/AUT-DEC-20261010043941588-7a619d.json",
    "hash": "a05711888ce0c3ea03f9226af0183186478a81be81bf3f752a8c5533c5dbd091"
  },
  "workflow_instance_ref": {
    "id": "delivery-successor",
    "path": ".sdlc/workflows/instances/delivery-successor/instance.json",
    "hash": "d015cd707f10e89bb040d21c48f322cc26df08aa63eae13626659d19f22bd106"
  },
  "delivery_start_receipt_ref": {
    "id": "AUT-START-AUT-SUCCESSOR",
    "path": ".sdlc/autonomy/executions/AUT-SUCCESSOR/start.json",
    "hash": "f1c8112c9d56306dfe30bf811fb2cba51c1e41ba95cd067015299fdd87329866"
  },
  "execution_context_preflight_ref": {
    "id": "PREFLIGHT-AUT-SUCCESSOR",
    "path": ".sdlc/autonomy/executions/AUT-SUCCESSOR/context-preflight.json",
    "hash": "3b85d77284af158f3fe1f2d456cb3d86cff2675f07d1fafe0318f251b52c6162"
  },
  "autonomy_level": "supervised",
  "start_basis": "explicit-confirmation",
  "status": "confirmed",
  "authorization_ref": null,
  "authorization_use_ref": null,
  "authority_assurance": {
    "mode": "audit_only",
    "receipt_ref": null,
    "source": "declared_cli_attribution",
    "verified": false
  },
  "confirmed_by": {
    "id": "antonioantenore",
    "type": "human",
    "name": "Finalization E2E",
    "email": "finalization-e2e@example.invalid",
    "source": "cli"
  },
  "confirmed_at": "2026-10-10T04:39:42.038Z",
  "audit": {
    "git": {
      "is_git_repo": true,
      "branch": "codex/ST-SUCCESSOR",
      "head_sha": "e8263f73edc89e8c9c6a5ec230966b8a1c39860d",
      "is_dirty": true,
      "user": {
        "name": "Finalization E2E",
        "email": "finalization-e2e@example.invalid"
      },
      "remotes": [
        "origin"
      ]
    },
    "run": {
      "run_id": null,
      "thread_id": null,
      "session_id": null,
      "tool": "agentic-sdlc-cli",
      "version": "0.94.0"
    }
  }
}
