{
  "id": "START-ST-REC-A-20261010043447524-85c8d5",
  "kind": "profile_task_start_receipt",
  "schema_version": "profile-task-start-receipt:v2",
  "story_id": "ST-REC-A",
  "phase": "implementation",
  "route": "claim_and_implement",
  "contract_id": "CONTRACT-REC-A",
  "contract_approval_hash": "5252e46354c6be367519f58fb6e35c53086c83c84db8fdb315505b101f962794",
  "delivery_profile_ref": {
    "id": "AUT-REC-A",
    "path": ".sdlc/autonomy/deliveries/AUT-REC-A.json",
    "hash": "707ea108f3223d6cb9ca4aded4a8fc3cf306164af8d186ab450051f78cecd2f5"
  },
  "autonomy_decision_ref": {
    "id": "AUT-DEC-20261010043445980-2ecae0",
    "path": ".sdlc/autonomy/decisions/AUT-DEC-20261010043445980-2ecae0.json",
    "hash": "d829beec0dae835c9d13f4044859fce0c4d7c1c60b3f52e84c9774e64ef95143"
  },
  "workflow_instance_ref": {
    "id": "delivery-rec-a",
    "path": ".sdlc/workflows/instances/delivery-rec-a/instance.json",
    "hash": "40936a3376d49e037e37fcdf233a0a20dc6eda9eb64f8eacc83de049d5970ed0"
  },
  "delivery_start_receipt_ref": {
    "id": "AUT-START-AUT-REC-A",
    "path": ".sdlc/autonomy/executions/AUT-REC-A/start.json",
    "hash": "ac6bf311fef415f6e9dacb31235b42decf25dcfa2ea63211dcf1f5bdaa6aeff8"
  },
  "execution_context_preflight_ref": {
    "id": "PREFLIGHT-AUT-REC-A",
    "path": ".sdlc/autonomy/executions/AUT-REC-A/context-preflight.json",
    "hash": "0fb82d8a0e32dd942f962fd42aeafad70b9f5090f85b70459aac22af9b321fd0"
  },
  "autonomy_level": "supervised",
  "start_basis": "explicit-confirmation",
  "status": "confirmed",
  "authorization_ref": null,
  "authorization_use_ref": null,
  "authority_assurance": {
    "mode": "audit_only",
    "receipt_ref": null,
    "source": "declared_cli_attribution",
    "verified": false
  },
  "confirmed_by": {
    "id": "antonioantenore",
    "type": "human",
    "name": "Merged Certification E2E",
    "email": "merged-certification-e2e@example.invalid",
    "source": "cli"
  },
  "confirmed_at": "2026-10-10T04:34:47.524Z",
  "audit": {
    "git": {
      "is_git_repo": true,
      "branch": "codex/ST-REC-A",
      "head_sha": "ebc3276106881e24f31451fb8d3eae93766a7688",
      "is_dirty": true,
      "user": {
        "name": "Merged Certification E2E",
        "email": "merged-certification-e2e@example.invalid"
      },
      "remotes": [
        "origin"
      ]
    },
    "run": {
      "run_id": null,
      "thread_id": null,
      "session_id": null,
      "tool": "agentic-sdlc-cli",
      "version": "0.94.0"
    }
  }
}
