{
  "id": "START-ST-SUCCESSOR-20261010043311393-b8cb28",
  "kind": "profile_task_start_receipt",
  "schema_version": "profile-task-start-receipt:v2",
  "story_id": "ST-SUCCESSOR",
  "phase": "implementation",
  "route": "claim_and_implement",
  "contract_id": "CONTRACT-SUCCESSOR-2",
  "contract_approval_hash": "150a3e25c4a69ea0ce795cb6be0ced775cfe2777ec741da140cc77020bf18dbd",
  "delivery_profile_ref": {
    "id": "AUT-SUCCESSOR-2",
    "path": ".sdlc/autonomy/deliveries/AUT-SUCCESSOR-2.json",
    "hash": "f6d55663782987f2fdbc9c87e2a9a3ca8e6f8815b82ed614eea554c1df351827"
  },
  "autonomy_decision_ref": {
    "id": "AUT-DEC-20261010043310926-226d02",
    "path": ".sdlc/autonomy/decisions/AUT-DEC-20261010043310926-226d02.json",
    "hash": "4f0529197c33a91ce99f980a5818bcdcb0c56ebc9a7c30469ae7c7edff0c574b"
  },
  "workflow_instance_ref": {
    "id": "delivery-successor",
    "path": ".sdlc/workflows/instances/delivery-successor/instance.json",
    "hash": "bde75c7a9cbe7b38fba053c98b2b4c9fb4b4526dfa4daba0f033f7231e76a251"
  },
  "previous_task_start_receipt_ref": {
    "id": "START-ST-SUCCESSOR-20261010043242063-5cadef",
    "path": ".sdlc/stories/ST-SUCCESSOR/task-start-history/START-ST-SUCCESSOR-20261010043242063-5cadef.json",
    "hash": "6e775246fb364b8af99d4c7832a1e7a259cd7c8725bf15a42886fb547118aab7"
  },
  "delivery_start_receipt_ref": {
    "id": "AUT-START-AUT-SUCCESSOR-2",
    "path": ".sdlc/autonomy/executions/AUT-SUCCESSOR-2/start.json",
    "hash": "bbc3a33bc50e3b2898899eca67d05b2323c54bc9e81a5cb7b4a214f634511a1c"
  },
  "execution_context_preflight_ref": {
    "id": "PREFLIGHT-AUT-SUCCESSOR-2",
    "path": ".sdlc/autonomy/executions/AUT-SUCCESSOR-2/context-preflight.json",
    "hash": "b68c6a3a799056fb148591f92e0ab562ebb9caf486a830e297a4fc7dfe1994d4"
  },
  "autonomy_level": "supervised",
  "start_basis": "explicit-confirmation",
  "status": "confirmed",
  "authorization_ref": null,
  "authorization_use_ref": null,
  "authority_assurance": {
    "mode": "audit_only",
    "receipt_ref": null,
    "source": "declared_cli_attribution",
    "verified": false
  },
  "confirmed_by": {
    "id": "antonioantenore",
    "type": "human",
    "name": "Finalization E2E",
    "email": "finalization-e2e@example.invalid",
    "source": "cli"
  },
  "confirmed_at": "2026-10-10T04:33:11.393Z",
  "audit": {
    "git": {
      "is_git_repo": true,
      "branch": "codex/ST-SUCCESSOR",
      "head_sha": "7291c535a28adae4bfa3067988dfd51ac1ffda67",
      "is_dirty": true,
      "user": {
        "name": "Finalization E2E",
        "email": "finalization-e2e@example.invalid"
      },
      "remotes": [
        "origin"
      ]
    },
    "run": {
      "run_id": null,
      "thread_id": null,
      "session_id": null,
      "tool": "agentic-sdlc-cli",
      "version": "0.94.0"
    }
  }
}
